{
  "puzzle": {
    "config": {
      "suspect_count": 16,
      "domains": {
        "location": [
          "Study",
          "Kitchen",
          "Library",
          "Garden"
        ],
        "motive": [
          "Revenge",
          "Inheritance",
          "Jealousy",
          "Blackmail"
        ],
        "time": [
          "20:00",
          "21:00",
          "22:00",
          "23:00"
        ],
        "weapon": [
          "Rope",
          "Wrench",
          "Poison",
          "Knife"
        ]
      },
      "clue_count": 22,
      "enabled_types": [
        "crime_different_from",
        "crime_negative",
        "crime_positive",
        "crime_same_as",
        "indirect_negative",
        "indirect_positive",
        "suspect_different_from",
        "suspect_same_as",
        "unary_negative",
        "unary_positive"
      ],
      "alpha": 0.7,
      "beta": 0.75,
      "min_murderer_links": 1,
      "max_murderer_links": null,
      "max_positive_murderer_links": null,
      "min_indirect_clues": 0,
      "min_unique_subset_size": 1,
      "require_indirect_essential": false,
      "min_pairwise_clues": 0,
      "active_values_per_attribute": null,
      "reasoning_route": "standard",
      "max_attempts": 64,
      "mutation_steps": 12,
      "max_solver_calls": 10000,
      "solver_seconds": 2.0,
      "solver_work": 0.2,
      "generation_seconds": 30.0
    },
    "family": "equality_tree",
    "assignment_mode": "repeated",
    "extra_clue_scope": "non_target_attributes",
    "attribute_mismatches": null
  },
  "evidence": {
    "minimum_sufficient_clues": 16,
    "maximum_sufficient_clues": 16,
    "entailed_clues": 0,
    "connected_decoys": 0,
    "irrelevant_records": 0,
    "false_reports": 0,
    "corruption_allowance": 0,
    "answerability": "unique",
    "corruption_strategy": "random",
    "corruption_search_attempts": 12,
    "maximum_alternative_margin": null
  },
  "distribution": {
    "agent_count": 8,
    "shared_reports": 0,
    "private_replication": 1,
    "per_agent_quotas": null,
    "minimum_coalition_size": 8,
    "max_attempts": 128
  },
  "presentation": {
    "theme": "mystery",
    "naming_seed": 0,
    "template": "compact",
    "clue_order": "shuffle",
    "evidence_placement": "front",
    "minimum_words": null,
    "maximum_words": null,
    "minimum_tokens": null,
    "maximum_tokens": null
  },
  "dataset": {
    "count": 10,
    "seed": 107,
    "workers": 1,
    "splits": {
      "development": 0.8,
      "test": 0.2
    },
    "holdout_families": [],
    "output_directory": "runs/advanced/distributed-eight",
    "certification_seconds": 30,
    "max_solver_calls": 20000,
    "max_candidates_per_case": 20,
    "large_corpus": false
  },
  "schema_version": "clue-community-1"
}
